{
  "blocker": null,
  "event_log_digest": "sha256:6e9ce2c44ec378b6d34e75663185563bd73e2ab766589948c0f565600d24845f",
  "last_event_at": "2026-07-20T00:00:01Z",
  "last_event_name": "finalization_completed",
  "last_event_seq": 7,
  "last_event_type": "stage_transition",
  "plugin": "zhulong",
  "plugin_version": "p9.5-closure-fixture",
  "resume_step": null,
  "run_id": "run-9c83a333aefa445e8c397d31b52b8a9e",
  "schema_version": 2,
  "stage": "finalization",
  "state_revision": 7,
  "status": "completed"
}
