{"blocker": null, "event_log_digest": "sha256:05b37866564705d4d5bcde4b3867e3b3f7945cb1a11a364e9f7c58cc3f6ff61e", "last_event_at": "2026-07-20T00:00:01Z", "last_event_name": "recon_started", "last_event_seq": 2, "last_event_type": "stage_transition", "plugin": "zhulong", "plugin_version": "p9.5-closure-fixture", "resume_step": null, "run_id": "run-72b32cc275da46eaba70b2a002cdc173", "schema_version": 2, "stage": "finalization", "state_revision": 2, "status": "completed"}
